ID,Monster Name,Plural,ID2,4,5,6,7,8,9,10,11,12,13,14,15
0000,,,0000,These,two-hex,SWAMPS are known for their,,,Beware of the,rough weather,,there. It is inhabited by,,and also,
0004,MEPHIT - Mud,MUD MEPHIT,0004,,three-hex,,muddy,baths.,,mud pits,when you travel by foot,,0004,,0004.
0009,BAT - Kongamato,KONGAMATO,0009,,four-hex,,isolated,fishing villages.,,the water,at night,,0009,,0009.
0010,WIZARD,WIZARD,0010,,five-hex,,mysterious,wizard tower.,,magical traps,controlled by a local <a href='/monsters/wizard'>WIZARD</a>,,0010,,0010.
0014,BOAR,BOAR,0014,,six-hex,,fragrant,truffles.,,hunters,near the wooden cabins,,0014,,0014.
0016,BASILISK,BASILISK,0016,,,,sulfurous,mounds.,,geodesic fumes,turning people into stone,,0016,,0016.